author,content,date,id,review_title
Nik Bhattacharya,"Hi, Could you please try from your computer web browser to link Mastermind. Go to the Amazon website, search for Mastermind Skill and link from there. Please make sure your Chrome browser allows the ""popup"" from Amazon when you try to link so it can launch the Google login flow. You can always email us at support@convessa.com and we can help you further. Thanks,Nik BhattacharyaCo Founder of Mastermind",1 month ago,4186ef09-f437-49db-a75a-6a7ee4eda7d6,Does not work
Nik Bhattacharya,"Hi there, sorry you are having trouble. It's Nik, the co founder of Mastermind. We are happy to give you a full refund if the product did not work for you. We are also very willing to work with with you to see if there is some troubleshooting you would like for us to do on your account.  Either way, we are here to help. Please contact us at support@convessa.com and we will get the issue resolved for you. Kind regards,Nik BhattacharyaCo Founder of Mastermind",1 month ago,29944705-9a92-4f8d-83f7-f951d2d09c6b,Don't buy for Alexa!
Nik Bhattacharya,"Hi Hadley,Version 22 of the BETA has this issue resolved. Please update the Mastermind Companion App from Google Play and you should be in business. If all works for you, we would appreciate you updating your review here. Thanks,Nik Bhattacharyaco founder of Mastermind",6 months ago,26450ab4-dda8-4011-9404-f136d688d59b,One Star
Nik Bhattacharya,"Hi Hadley, this is Nik Bhattacharya the co founder of Mastermind.Looks like so many people were using our service that our server got backed up and stopped responding to some users. Thank you for pointing this out. We have fixed the issue.We restarted the server and added more threads. All should be good now. This is why we are in closed beta so we can do stress testing and make sure we perform under extremely heavy loads. Please try again. Let us know what you see. Again, we appreciate the feedback. Thanks,Nik Bhattacharya",6 months ago,6f2351e8-0925-43d8-b21e-00368d7a87e6,One Star
Nik Bhattacharya,"Hi Big Daddy Ray,Sorry you seem to have problems linking. The best way for us to help you is to reach us at support@convessa.com. We put in over a year of work on Mastermind before we launched on Alexa. We can assure you that we did our due diligence before we put Mastermind on Alexa. Please feel free to email us with your specific issue. We are sure we will be able to resolve it. Best regards,Nik BhattacharyaCo Founder of Mastermind",3 months ago,3c3aa1f4-6b7c-48ff-92b1-13059ae8c1ab,Will not work. Get error message.  Will not link.
Nik Bhattacharya,"I am a co-founder of Mastermind.In order to use the Mastermind skill, you will need to link your account using the Alexa app.  Here are the steps:1. Install Mastermind on your Amazon Echo. Do this by saying ""Alexa enable Mastermind""2. Login to the Mastermind skill in the Alexa app.  Use a gmail account and remember which gmail account you used. You will need that in a later step. 3. Once you complete step 2, you will get an email to the gmail that you used in step 2 with a link to the Mastermind app for your phone. Go ahead and install the app on your phone.4. Login to the Mastermind app you just installed in step 3 on your phone. Use the same gmail account you used in the Alexa skill to login to Mastermind. 5. You are all set as far as the installs go. Keep in mind that we have a closed beta, so after you complete these steps, you will have the option to either purchase instant access to start using Mastermind immediately, or you can wait for an email from us to let you into the closed beta.Mastermind is one of the most complex skills available for Alexa. We launched it in closed beta so we can slowly add people to the system to make sure we handle scaling correctly. That is the reason behind the waitlist. You do not have to pay to be a part of our beta. Every day we add more users from the waitlist into the beta. More details about the closed beta: http://mastermindbot.com/2016/12/18/mastermindclosedbetanowavailable/More details about mastermind: http://mastermindbot.com/See a video of Mastermind in action: https://www.youtube.com/watch?v=EGgNa4OYARc&t=2sI hope these instructions help you get setup. Please reach out to us at support@convessa.com if you have further needs.Nik",7 months ago,c865e0ec-ddbc-4d75-bc35-d52a3bc5cb9a,No Instructions
Laura van Dalen,"I have uploaded my contacts in the Latest Mastermind. That was an step forward. It still says that the contact doesn't exist.It also says that I'm still in Beta and that I can go ahead and pay for the instant access. I have access, just not doing anything I ask for.Thank you for your assistance.",3 months ago,c70c5220-38aa-413a-a07c-f1925df16a1f,It doesn't work
Nik Bhattacharya,"Hi Laura,Please update your app on your phone to the latest version of Mastermind. We have added a section in the settings specifically to deal with contacts. This should help you. You are always welcome to email us at support@convessa.com to get help. We would love the opportunity to get things working for you so you can make your 1 star into a happier review. Our best regards to you and please do reach out to us. Nik BhattacharyaCo Founder of MastermindThis link might help:http://www.mastermindbot.com/mastermindcontacts",3 months ago,cecdbe5e-3aaa-4d93-86dd-513f52e879ee,It doesn't work
Susan C. Alexandre,I actually LOVED the fact that you have the option to either wait or pay..... I wish more apps offered that.   I chose to wait a little while and it was only a matter of days before I was granted access.  It sure beats having the app crash from having too many people signing on and downloading it at the same time.,6 months ago,0b0507e7-83fd-45a0-bb1d-ae5c4eba9274,Really???
Nik Bhattacharya,"Hi Fred, I am a co-founder of Mastermind. Now that you have been given access to the beta after being on the waitlist, would you be kind enough to update the review?We just launched Mastermind and believe that Mastermind will appeal to many of the over 5 million Alexa users. We decided to launch Mastermind as a closed beta so we can slowly add people to the system to make sure we handle scaling correctly. That is the reason behind the waitlist. We believe there is nothing more frustrating than an app that says it does great things and then crashes under heavy loads.You do not have to pay to be a part of our beta. We already added 5-10% of the people on the waitlist into the beta. We typically add people who have both the Alexa app and Android companion app linked in the order they enabled the skill.We do give the option to people who really want this skill now to pay to get early access instead of just relying on our timeline to let you in. We absolutely understand that this will only be a small percentage of people who want instant access, and for them we see this as a choice they can decide to exercise or not.If you are interested in seeing why we think Mastermind is going to be a popular skill, take a look at the video: https://www.youtube.com/watch?v=EGgNa4OYARc&t=2sI hope this addresses your concerns,Nik",7 months ago,a1a6f76e-aa98-4323-ab21-cf3bb4d0c3c8,Really???
Nik Bhattacharya,"Hi Robert,First of all, our apologies that you are having trouble with Mastermind. Let us try to help. Have you tried seeing if you could actually send a text message? Or is it saying that your contacts list is empty when you try that?You are most welcome to email us at support@convessa.com and we will try out best to provide you with assistance. Again, apologies for a sub-optimal experience for you. Nik BhattacharyaCo Founder of Mastermind",2 months ago,4672feaf-a25e-4c98-9556-3273f8213f47,One Star
Nik Bhattacharya,"Hi Robert,Currently Mastermind is available for phones and tablets running Android.  We do plan to add iPhone support by the middle to end of 2017. With the closed nature of the iPhone and the Apple ecosystem in general, not all features will be supported.Nik Bhattacharya Co founder of Mastermind",7 months ago,703929bb-34c2-4b62-a82c-5f2221b58767,It sounds wonderful. Is there any chance it will be available ...
Nik Bhattacharya,"Hi, this is Nik Bhattacharya, the co founder of Mastermind. Sorry that you are having trouble using Mastermind. Mastermind is one of the most complex skills available on Alexa and supports over 30 different flows and commands out of the box. While we do our best to process every command, at the end of the day, we are completely dependent on the inputs that Alexa gives our skill. While Amazon supports simple skills very well (because they have a single utterance or a few commands), Alexa is quite flaky when it comes to deciphering your speech at times when it comes to more complex skills like Mastermind. And sometimes it depends on the day of the week (somedays are better than others) as Amazon is constantly updating their speech recognition software. We are working with Amazon to let them know what we are finding regarding their speech recognition. Ultimately, it will be up to Amazon to implement these or decide not to. We understand that this can be frustrating as you really want everything to work. When Alexa is having a good day, all is beautiful. When Alexa's speech algorithms take a turn for the worse depending on the day...yesterday when you wrote the review, was a poor speech recognition day and many developers including us opened bugs on the Amazon Alexa Developer Forum:https://forums.developer.amazon.com/questions/66664/custom-slots-stopped-working-4112017.htmlWe would appreciate it if you try again and see if things are better today. We are happy to answer your questions at support@convessa.com.Regards,Nik BhattacharyaCo Founder of Mastermind",4 months ago,e164b11c-2973-41c0-a55e-470d29c74652,Does not work properly
Susan C. Alexandre,"There is not a $15 monthly fee...... it's an OPTIONAL one-time fee if you want the app immediately.  If you can wait a few days, it's free.",6 months ago,c3391bc7-2303-4ade-b9a7-46214bae91e3,"$!5 per month, waiting list?? Don't click this app, it is click bait fishing for email addresses"
Nik Bhattacharya,"I am a co-founder of Mastermind. Now that you have been given beta access after being on the waitlist, would you be kind enough to update your review?Mastermind is one of the most complex skills available for Alexa. We launch it in closed beta so we can slowly add people to the system to make sure we handle scaling correctly. That is the reason behind the waitlist. You do not have to pay to be a part of our beta. We already added 10% of the people on the waitlist into the beta. Everday we add more users from the waitlist into the beta. We provide a way for people to get priority access for free. We add people from the waitlist to the beta who have both the Alexa app and Android companion app linked before people with just the skill installed.People who don't want to wait can **optionally** pay $15 one time (not monthly) to get instant access to the beta. We are making changes to make this more clear that this is completely optional. It's important to note that the vast majority of people in the beta did not have to pay anything.We take your feedback seriously. We will update the description of our skill to mention that its a closed beta and there is a waitlist. Since changing one word of the our skill's description will cause it to go through another certification cycle we plan to make that change with the next batch of updates.  More details about the closed beta: http://mastermindbot.com/2016/12/18/mastermindclosedbetanowavailable/More details about mastermind: http://mastermindbot.com/See Mastermind in action: https://www.youtube.com/watch?v=EGgNa4OYARc&t=2sI hope this addresses your concerns,Nik",7 months ago,14994746-114b-478e-a44f-b34ff8ffaa49,"$!5 per month, waiting list?? Don't click this app, it is click bait fishing for email addresses"
Nik Bhattacharya,"Hello, we saw your review on Google Play as well and invite you to email us at support@convessa.com to give us more details on your specific issues. We couldn't figure out which of the 30+ commands that Mastermind supports is not working for you from your comment.  Just in case, here are the commands that work with Mastermind:** Most popularAlexa Ask Mastermind to Send MessageAlexa Ask Mastermind to Get My NotificationsAlexa Ask Mastermind to Ring My PhoneAlexa Ask Mastermind What Was that?Alexa Ask Mastermind to Send Message to First LastAlexa Ask Mastermind for HelpAlexa Ask Mastermind to Get My MessagesAlexa Ask Mastermind to Make PhonecallAlexa Ask Mastermind to Call Firstname LastnameAlexa Ask Mastermind to Get My Status UpdateAlexa Ask Mastermind Who’s Calling?Alexa Ask Mastermind to Start CastingAlexa Ask Mastermind How Much Battery Do I Have? (Android 6.0+)Alexa Ask Mastermind For My Battery Status (Android 6.0+)Alexa Ask Mastermind to Turn on Do Not Disturb (Android 6.0+)Alexa Ask Mastermind to Lookup Contact** Other commandsAlexa Ask Mastermind to Clear My NotificationsAlexa Ask Mastermind to End CallAlexa Ask Mastermind to Accept CallAlexa Ask Mastermind to Reject CallAlexa Ask Mastermind to Send Call to VoicemailAlexa Ask Mastermind to Get My CalendarAlexa Ask Mastermind to Get My ScheduleAlexa Ask Mastermind to Get My Reading ListAlexa Ask Mastermind to Clear My Reading ListAlexa Ask Mastermind to Stop CastingAlexa Ask Mastermind to Start NavigationAlexa Ask Mastermind to Start AppNameAlexa Ask Mastermind to Launch AppNameAlexa Ask Mastermind to Get My Battery Status (Android 6.0+)Alexa Ask Mastermind to Get My App Usage (Android 6.0+)Alexa Ask Mastermind to Get My Network Usage (Android 6.0+)Alexa Ask Mastermind to Turn on BluetoothAlexa Ask Mastermind to Turn on WiFiAlso, here is the FAQ Page for Most common questions:http://www.mastermindbot.com/FAQHere is the Youtube Channel with videos about Mastermind:https://www.youtube.com/channel/UCZr21AyoD42qXuh1FpXQsBgHere is our Facebook page:http://facebook.com/mastermindbotsOur Twitter handle is @Convessa Feel free to get in touch. Best,Nik BhattacharyaCo Founder of Mastermind",2 months ago,d623b978-1422-4710-8d45-0e10e2a16d50,Waste of time
Nik Bhattacharya,"Hi Troy,This is Nik Bhattacharya, the Co Founder of Mastermind. We put in over a year of work to get Mastermind working the way it does. We'd love to hear which parts of Mastermind you would like enhanced. You can always email us at support@convessa.com with your constructive feedback. In the meanwhile, for the readers of this review, here are a list of commands that Mastermind currently supports:Mastermind Commands for Text Messaging, Notifications, Phone Calls and more on AlexaMost popular----------------Alexa Ask Mastermind to Send MessageAlexa Ask Mastermind to Get My NotificationsAlexa Ask Mastermind to Ring My PhoneAlexa Ask Mastermind What Was that?Alexa Ask Mastermind to Send Message to First LastAlexa Ask Mastermind for HelpAlexa Ask Mastermind to Get My MessagesAlexa Ask Mastermind to Make PhonecallAlexa Ask Mastermind to Call Firstname LastnameAlexa Ask Mastermind to Get My Status UpdateAlexa Ask Mastermind Who’s Calling?Alexa Ask Mastermind to Start CastingAlexa Ask Mastermind How Much Battery Do I Have? (Android 6.0+)Alexa Ask Mastermind For My Battery Status (Android 6.0+)Alexa Ask Mastermind to Turn on Do Not Disturb (Android 6.0+)Alexa Ask Mastermind to Lookup ContactOther commands---------------------Alexa Ask Mastermind to Clear My NotificationsAlexa Ask Mastermind to End CallAlexa Ask Mastermind to Accept CallAlexa Ask Mastermind to Reject CallAlexa Ask Mastermind to Send Call to VoicemailAlexa Ask Mastermind to Get My CalendarAlexa Ask Mastermind to Get My ScheduleAlexa Ask Mastermind to Get My Reading ListAlexa Ask Mastermind to Clear My Reading ListAlexa Ask Mastermind to Stop CastingAlexa Ask Mastermind to Start NavigationAlexa Ask Mastermind to Start AppNameAlexa Ask Mastermind to Launch AppNameAlexa Ask Mastermind to Get My Battery Status (Android 6.0+)Alexa Ask Mastermind to Get My App Usage (Android 6.0+)Alexa Ask Mastermind to Get My Network Usage (Android 6.0+)Alexa Ask Mastermind to Turn on BluetoothAlexa Ask Mastermind to Turn on WiFi",3 months ago,29fa3117-5710-46b0-8d8d-a54f7a76ce2a,Just like 99% of all skills its too unfinished
Nik Bhattacharya,"Hello Linda, I am the co founder of Mastermind.Given your special circumstances, we will be happy to expedite you into our beta. We will need for you to login to Mastermind on both Alexa and your Google Android phone using the same gmail address. Please send us an email at support@convessa.com and tell us the gmail address that you used. We will get you onto the system.  Thanks and look forward to hearing from you. Best,Nik Bhattacharyaco founder of Mastermind",4 months ago,7c2bd5da-ca0c-46ea-8e99-ceb12bac51c9,back surgery/cant wait to get this
Susan C. Alexandre,If you don't have the time or patience to wait they offer an option to obtain it immediately for $15..... a one time charge.,6 months ago,a17587f0-ea75-42da-9951-d84c82b53d2b,Still wait
Nik Bhattacharya,"Hi, Please be patient. We literally have people knocking down our doors. You will get in, we promise. It should be a few more days. Nik",6 months ago,c4707dd6-4538-4a2e-bb04-ca27d4afa4c0,Still wait
Nik Bhattacharya,"Hi, Apple support is planned for late 2017. The key premise of Mastermind is full accessibility of your phone from Alexa without touching your phone. 30 features spanning SMS text messaging using your carrier assigned number, making phone calls, getting all your notifications, launching apps, getting data usage etc.Apple gives 3rd party applications very limited ability to integrate deeply with the phone. We do not want Mastermind users to sign up for a completely new SMS/Phone number. Users should be able to use their existing phone number so they can use a service they are already paying for and not confuse their friends and family with a new number. Unfortunately, as of right now Apple neither allows third party applications to send or receive a text message on your behalf nor place an outgoing phone call for you. We are trying to figure out if there are acceptable workarounds to these restrictions that Apple puts on third parties even if the iPhone user is completely ok with an app like Mastermind to do things like send messages and make phone calls.So Apple users, stay tuned. We will have something great for you. It may just be of a slightly different flavor than the dish we are currently serving your Android cousins.Best,Nik BhattacharyaCo Founder of Mastermind",3 months ago,6a8cbaab-00db-407e-be73-0ac97293423f,iPhones??????
Nik Bhattacharya,"Hi Mamist, this is Nik Bhattacharya the co founder of MastermindWe are so sorry that you are having trouble using Mastermind. We know that we do a lot of functions to connect your phone, TV and PC to your Alexa and that sometimes there are questions that people may have about how to use Mastermind or problems getting everything to work when they are brand new on the system. If everything I outline below doesn't work, please do email us directly and we will help you out. --------------------------------------------------------------------------------------------------------------First, we have answered a lot of questions that have been asked by our users on our FAQ:http://www.mastermindbot.com/FAQSecond, please refer to the entire list of Mastermind commands on our website:http://www.mastermindbot.com/commandsThird, we made some training videos and have posted them to social media. Please see Youtube and Facebook links below for the training videos:http://www.facebook.com/mastermindbotshttps://www.youtube.com/playlist?list=PLSWJb3L65NvLO8-WKk7LBYqlzwDEO1cVGWe really hope you can figure things out and get going on Mastermind. As I said before, you are always welcome to email us at support@convessa.com and we can help you that way as well. Our best regards,Nik Bhattacharyaco founder of Mastermind",6 months ago,34386666-ef3b-4f39-a07b-4343bd2f723e,Still figuring out
Nik Bhattacharya,"Hi, Apple support is planned for late 2017. The key premise of Mastermind is full accessibility of your phone from Alexa without touching your phone. 30 features spanning SMS text messaging using your carrier assigned number, making phone calls, getting all your notifications, launching apps, getting data usage etc.Apple gives 3rd party applications very limited ability to integrate deeply with the phone. We do not want Mastermind users to sign up for a completely new SMS/Phone number. Users should be able to use their existing phone number so they can use a service they are already paying for and not confuse their friends and family with a new number. Unfortunately, as of right now Apple neither allows third party applications to send or receive a text message on your behalf nor place an outgoing phone call for you. We are trying to figure out if there are acceptable workarounds to these restrictions that Apple puts on third parties even if the iPhone user is completely ok with an app like Mastermind to do things like send messages and make phone calls.So Apple users, stay tuned. We will have something great for you. It may just be of a slightly different flavor than the dish we are currently serving your Android cousins.Best,Nik BhattacharyaCo Founder of Mastermind",3 months ago,01632ff9-854f-497d-aaf9-98f23177a03e,Doesn't work at all
Nik Bhattacharya,"I am a co-founder of Mastermind. Now that you have been given access, would you be kind enough to update your review?Mastermind is one of the most complex skills available for Alexa and we have spent well over a year in R&D before we made it available. We launched it in closed beta so we can slowly add people to the system to make sure we handle scaling correctly. That is the reason behind the waitlist. You do not have to pay to be a part of our beta. We already added 10% of the people on the waitlist into the beta. Everyday, we add more users from the waitlist into the beta, so if you are on the waitlist you just have to be a bit patient. We provide a way for people to get priority access for free. We add people from the waitlist to the beta who have both the Alexa app and Android companion app linked before people with just the skill installed.People who don't want to wait can **optionally** pay $15 one time to get instant access to the beta. We are making changes to make this more clear that this is completely optional. It's important to note that the vast majority of people in the beta did not have to pay anything.We take your feedback seriously. If you have the Android app and the Alexa skill installed, you will most likely get into the closed beta within the next couple weeks. We would appreciate it if you update the review as you have used some words that could seriously undermine our efforts to provide you with a high quality product and not a sham.  More details about the closed beta: http://mastermindbot.com/2016/12/18/mastermindclosedbetanowavailable/More details about Mastermind: http://mastermindbot.com/See Mastermind in action: https://www.youtube.com/watch?v=EGgNa4OYARc&t=2sI hope this addresses your concerns,Nik BhattacharyaCo-Founder of Mastermind & Co-CEO of Convessa, Inc.http://www.mastermindbot.comhttp://www.convessa.com",7 months ago,68bf0dc9-9515-4a43-bd8e-9ee8e613d8c1,Beware
Nik Bhattacharya,"Hi Brian, this is Nik Bhattacharya the co founder of Mastermind.Sorry for the frustration! Not quite sure what could be going on. Would you like to email us at support@convessa.com and tell us a bit more (and maybe tell us your email that you used to login to Mastermind so we can lookup your account).  We have a FAQ that we keep updated with most of the issues that we see people having. Could you take a look here too to see if there is anything helpful:www.mastermindbot.com/FAQEither way, we can help. Please do reach out via email. Best,Nik Bhattacharyaco founder of Mastermind",4 months ago,3b535817-8aa7-4881-9fa1-e31db4ba8ddd,Never works
Nik Bhattacharya,"Hi Bruce, this is Nik Bhattacharya, the co founder of Mastermind. We are not a scam, just a really **high quality skill** that we have launched in closed beta after spending more than a year in research and development because of how complex and powerful it is. Our terms of the closed beta are very clearly written on the Alexa Skill listing. We would be happy to hear from you if you think we could make it more explicit.  Please contact us at support@convessa.com if you have constructive feedback. We would love to hear from you.Just in case you did miss the terms we have on the closed beta, I have appended it word-for-word below. Thank you for your interest in Mastermind.****************************************************IMPORTANT TERMSMastermind is currently in closed beta. Due to the high demand we are seeing, when you enable the skill you will be added to a waitlist. Every day we grant people on the waitlist access to the beta. The waitlist is necessary to ensure that our system scales correctly. You do not have to pay to be part of the beta, but just have to wait your turn. Link both the Alexa Skill and Android App and you will be given priority access (i.e. moved in-front of people without both linked). We will email you when you have been added to the beta.For those who wish to bypass the waitlist, we have a paid option for US $15 that will give you instant access to all the functionality of Mastermind during the closed beta. See the Mastermind Android companion app for details. The users who pay for instant access will get the first year for free when Mastermind comes out of closed beta and moves to a paid subscription service model.Only enable the skill if you wish to be part of the closed beta as per the terms above.****************************************************",6 months ago,ea408f3c-1c6d-4b3c-bc7f-8b48b08bc4e9,Scam to get $15
